"First One-time Password","Notes","Password","Title","Type","URL","Username",
,,"Jz*YMy.CpkLLxb.QzuJg7sDMj3","A Title for whatever","Login",,"whatever",
,,"TGe3xQxzZ8t4nfzQ-vpY6@D4GnCQaFTuD3hDe72D3btt!","Some sort of Title","Login","https://au.example.com","tésting@au.example.org",
,,"N7A@,vD\\/zHuzx:'CBnkocCZw\"s_\RE7","Another Title for Login","Login","https://example.org","random@example.com",
,"Follow these steps to get started.",,"🎉 Welcome to 1Password!","Secure Note",,,
,"It’s you! 🖐 Select Edit to fill in more details, like your address and contact information.",,"Some sort of title of David","Identity",,,
